{
  "generatedAt": "2026-08-23T21:01:35Z",
  "pipelineCommit": "9b54e4a07608a4d1cc6a44da1d992acb93b6c839",
  "lastDataDate": "2026-08-23",
  "confidenceLevel": 0.8,
  "bootstrapReplicates": 60,
  "synthetic": true,
  "performanceSource": "leaguepedia",
  "metricComponents": [
    "dmgshare",
    "rendement",
    "kp",
    "survie",
    "vision"
  ],
  "counts": {
    "players": 204,
    "playerGames": 14400,
    "teams": 20,
    "leagues": 2,
    "transitions": 36
  },
  "unmatchedRate": 0,
  "sources": [
    {
      "name": "Oracle's Elixir",
      "url": "https://oracleselixir.com/tools/downloads",
      "licence": "Usage libre avec attribution",
      "retrievedAt": "2026-08-23"
    },
    {
      "name": "Leaguepedia / Fandom",
      "url": "https://lol.fandom.com",
      "licence": "CC BY-SA",
      "retrievedAt": "2026-08-23"
    }
  ]
}

